<?xml version="1.0" encoding="UTF-8" standalone="no"?>
<xsd:schema xmlns:xsd="http://www.w3.org/2001/XMLSchema"
            targetNamespace="http://kefir-bb.sourceforge.net/schemas"
            xmlns="http://kefir-bb.sourceforge.net/schemas"
            elementFormDefault="qualified"
            attributeFormDefault="unqualified">
    <!-- Template type description -->
    <xsd:complexType name="templateType" mixed="true">
        <xsd:choice minOccurs="0" maxOccurs="unbounded">
            <xsd:element name="var">
                <xsd:complexType>
                    <xsd:attribute name="name" type="xsd:string" default="variable"/>
                </xsd:complexType>
            </xsd:element>
        </xsd:choice>
    </xsd:complexType>

    <!-- Code tag description -->
    <xsd:complexType name="codeType">
        <xsd:sequence>
            <xsd:element name="pattern">
                <xsd:complexType mixed="true">
                    <xsd:choice minOccurs="0" maxOccurs="unbounded">
                        <xsd:element name="var">
                            <xsd:complexType>
                                <xsd:attribute name="name" type="xsd:string" default="variable"/>
                                <xsd:attribute name="parse" type="xsd:boolean" default="true"/>
                                <xsd:attribute name="regex" type="xsd:string" default=".*"/>
                                <xsd:attribute name="scope" type="xsd:IDREF" default="ROOT"/>
                                <xsd:attribute name="inherit" type="xsd:boolean" default="false"/>
                                <xsd:attribute name="transparent" type="xsd:boolean" default="false"/>
                            </xsd:complexType>
                        </xsd:element>
                    </xsd:choice>
                </xsd:complexType>
            </xsd:element>
            <xsd:element name="template" type="templateType"/>
        </xsd:sequence>
        <xsd:attribute name="name" type="xsd:ID"/>
        <xsd:attribute name="priority" type="xsd:integer" default="0"/>
    </xsd:complexType>

    <xsd:element name="configuration">
        <xsd:complexType>
            <xsd:sequence>
                <xsd:element name="params" minOccurs="0" maxOccurs="1">
                    <xsd:complexType>
                        <xsd:choice minOccurs="0" maxOccurs="unbounded">
                            <xsd:element name="param">
                                <xsd:complexType>
                                    <xsd:attribute name="name" type="xsd:string" use="required"/>
                                    <xsd:attribute name="value" type="xsd:string" use="required"/>
                                </xsd:complexType>
                            </xsd:element>
                        </xsd:choice>
                    </xsd:complexType>
                </xsd:element>
                <xsd:element name="prefix" type="templateType" minOccurs="0" maxOccurs="1"/>
                <xsd:element name="suffix" type="templateType" minOccurs="0" maxOccurs="1"/>
                <xsd:choice minOccurs="0" maxOccurs="unbounded">
                    <xsd:element name="code" type="codeType"/>
                    <xsd:element name="scope">
                        <xsd:complexType>
                            <xsd:choice minOccurs="0" maxOccurs="unbounded">
                                <xsd:element name="coderef">
                                    <xsd:complexType>
                                        <xsd:attribute name="name" type="xsd:IDREF" use="required"/>
                                    </xsd:complexType>
                                </xsd:element>
                                <xsd:element name="code" type="codeType"/>
                            </xsd:choice>
                            <xsd:attribute name="name" type="xsd:ID" use="required"/>
                            <xsd:attribute name="parent" type="xsd:IDREF" use="optional"/>
                            <xsd:attribute name="ignoreText" type="xsd:boolean" use="optional" default="false"/>
                        </xsd:complexType>
                    </xsd:element>
                </xsd:choice>
            </xsd:sequence>
        </xsd:complexType>
    </xsd:element>
</xsd:schema>