<?xml version="1.0" encoding="utf-8"?>
<configuration xmlns:xsi="http://www.w3.org/2001/XMLSchema-instance"
               xmlns="http://kefir-bb.sourceforge.net/schemas"
               xsi:schemaLocation="http://kefir-bb.sourceforge.net/schemas http://kefir-bb.sourceforge.net/schemas/kefir-bb-0.5.xsd">
    <scope name="ROOT" parent="sc">
        <code>
            <pattern>*<var/>*</pattern>
            <template>!<var/>!</template>
        </code>
    </scope>
    <scope name="sc">
        <code>
            <pattern>@<var/>@</pattern>
            <template>#<var/>#</template>
        </code>
    </scope>
</configuration>