<?xml version="1.0" encoding="utf-8"?>
<configuration xmlns:xsi="http://www.w3.org/2001/XMLSchema-instance"
               xmlns="http://kefir-bb.sourceforge.net/schemas"
               xsi:schemaLocation="http://kefir-bb.sourceforge.net/schemas http://kefir-bb.sourceforge.net/schemas/kefir-bb-0.5.xsd">
    <code>
        <pattern>def <var name="id" regex="\w+"/>=<var name="value" regex="\d+"/>;</pattern>
        <template><var name="id"/>:<var name="value"/></template>
    </code>
</configuration>